{"schema_id":"learning-julia.p2.selection-count-api-request","schema_version":"1.0.0","request_id":"teaching-example-v1","model_scope":{"family":"Normal","selection_rule":"strict_open_interval","automatic_interval_selection":false},"input_contract":{"total_screened":400,"selected_count":43,"lower_boundary":36.78637571034638,"upper_boundary":37.21362428965362,"boundary_rule":"lower < value < upper","selected_values":[36.933406654823095,37.03066967414607,36.978163286905435,37.11339915490478,36.78673172537175,37.066519931672396,36.89337672240167,37.19442801285594,36.910494226218404,36.830565335890086,37.2061720495295,36.9981569521577,37.15690033328665,36.82120648137176,37.11391038239755,36.811833934270176,36.86291748841873,37.12581076742446,36.879980241973854,37.0581322047395,37.19735117064332,36.794588272611946,36.795176492718596,36.91153901676415,36.835289956583125,37.075262059349484,37.03180338346997,37.07722028066175,36.96241733210636,37.18601812791026,36.83351876274737,36.89251483807153,36.80306675166896,36.93913990796957,37.13504411496884,37.0018693677057,36.881906075161496,36.934592300387884,37.18617345370549,36.855974768571244,37.11480532136745,36.92684936075618,37.07655955544954],"assumptions_confirmed":{"boundary_precommitted":true,"same_boundary":true,"same_population":true,"independent_rows":true,"exact_selected_values":true,"excluded_confirmed_outside":true}},"analysis_options":{"random_seed":20279001,"bootstrap_repetitions":99,"minimum_bootstrap_success_rate":0.9,"profile_max_expansions":14}}